{
  "$schema": "https://json-schema.org/draft/2020-12/schema",
  "title": "Plan State",
  "description": "Conductor's plan.yaml — ordered phases, conditional phases, final phases, mutation history.",
  "type": "object",
  "required": ["engagement_id", "created_at", "phases", "conditional_phases", "final_phases"],
  "additionalProperties": false,
  "properties": {
    "engagement_id": { "type": "string", "minLength": 1 },
    "created_at": { "type": "string", "format": "date-time" },
    "phases": {
      "type": "array",
      "items": { "$ref": "#/$defs/phaseEntry" }
    },
    "conditional_phases": {
      "type": "array",
      "items": { "$ref": "#/$defs/conditionalPhase" }
    },
    "final_phases": {
      "type": "array",
      "items": { "$ref": "#/$defs/finalPhase" }
    }
  },
  "$defs": {
    "phaseEntry": {
      "type": "object",
      "required": ["name", "status", "rerun_count"],
      "additionalProperties": false,
      "properties": {
        "name": { "type": "string", "minLength": 1 },
        "status": { "enum": ["pending", "in_progress", "complete", "skipped"] },
        "started_at": { "type": ["string", "null"], "format": "date-time" },
        "completed_at": { "type": ["string", "null"], "format": "date-time" },
        "rerun_count": { "type": "integer", "minimum": 0, "maximum": 5 },
        "rerun_params": { "type": "object" },
        "phase_deadline_seconds": { "type": ["integer", "null"], "minimum": 1 }
      }
    },
    "conditionalPhase": {
      "type": "object",
      "required": ["name", "status", "unlock_when", "insert_before"],
      "additionalProperties": false,
      "properties": {
        "name": { "type": "string", "minLength": 1 },
        "status": { "enum": ["locked", "unlocked", "skipped"] },
        "unlock_when": { "type": "string", "minLength": 1 },
        "insert_before": { "type": "string", "minLength": 1 }
      }
    },
    "finalPhase": {
      "type": "object",
      "required": ["name", "status"],
      "additionalProperties": false,
      "properties": {
        "name": { "type": "string", "minLength": 1 },
        "status": { "enum": ["pending", "in_progress", "complete", "skipped"] },
        "started_at": { "type": ["string", "null"], "format": "date-time" },
        "completed_at": { "type": ["string", "null"], "format": "date-time" }
      }
    }
  }
}
