{
  "engagement_id": "fixture-d1",
  "created_at": "2026-05-07T14:00:00Z",
  "phases": [
    {"name": "recon-passive", "status": "pending", "rerun_count": 0},
    {"name": "recon-active", "status": "pending", "rerun_count": 0},
    {"name": "enum-web", "status": "pending", "rerun_count": 0},
    {"name": "prioritize", "status": "pending", "rerun_count": 0},
    {"name": "scan-vuln", "status": "pending", "rerun_count": 0},
    {"name": "exploit-assist", "status": "pending", "rerun_count": 0}
  ],
  "conditional_phases": [
    {"name": "enum-cloud", "status": "locked", "unlock_when": "cloud assets fingerprinted (S3, Azure blob, GCP storage, IAM)", "insert_before": "prioritize"},
    {"name": "attack-ad", "status": "locked", "unlock_when": "AD or Kerberos services fingerprinted", "insert_before": "post-exploit"}
  ],
  "final_phases": [
    {"name": "finding-write", "status": "pending"},
    {"name": "pentest-export", "status": "pending"}
  ]
}
